{
    "$schema": "http://json-schema.org/draft-04/schema#",
    "title": "CatalogDelta",
    "description": "A puppet resource catalog delta",
    "type": "object",
    "properties": {
        "node_name": {
            "type": "string",
            "description": "The name of the node for which the baseline and preview catalogs were compiled"
        },
        "timestamp": {
            "type": "string",
            "description": "When preview run began. In ISO 8601 format with 9 characters second-fragment"
        },
        "produced_by": {
            "type": "string",
            "description": "Name and version of tool that produced this delta"
        },
        "baseline_env": {
            "type": "string",
            "description": "The name of the baseline catalog environment"
        },
        "preview_env": {
            "type": "string",
            "description": "The name of the preview catalog environment"
        },
        "baseline_catalog": {
            "type": "string",
            "description": "the file name of the baseline catalog"
        },
        "preview_catalog": {
            "type": "string",
            "description": "the file name of the preview catalog"
        },
        "baseline_resource_count": {
            "type": "integer",
            "description": "number of resources in the baseline catalog"
        },
        "preview_resource_count": {
            "type": "integer",
            "description": "number of resources in the preview catalog"
        },
        "baseline_edge_count": {
            "type": "integer",
            "description": "number of edges in the baseline catalog"
        },
        "preview_edge_count": {
            "type": "integer",
            "description": "number of edges in the preview catalog"
        },
        "added_resource_count": {
            "type": "integer",
            "description": "number of resources in preview but not in baseline"
        },
        "equal_resource_count": {
            "type": "integer",
            "description": "number of resources in both preview and baseline"
        },
        "missing_resource_count": {
            "type": "integer",
            "description": "number of resources in baseline but not in preview"
        },
        "conflicting_resource_count": {
            "type": "integer",
            "description": "number of resources in both baseline and preview with conflicting attributes"
        },
        "added_edge_count": {
            "type": "integer",
            "description": "number of edges in preview but not in baseline"
        },
        "missing_edge_count": {
            "type": "integer",
            "description": "number of edges in baseline but not in preview"
        },
        "equal_attribute_count": {
            "type": "integer",
            "description": "total number of resource attributes in both preview and baseline"
        },
        "added_attribute_count": {
            "type": "integer",
            "description": "total number of resource attributes in preview but not in baseline"
        },
        "missing_attribute_count": {
            "type": "integer",
            "description": "total number of resource attributes in baseline but not in preview"
        },
        "conflicting_attribute_count": {
            "type": "integer",
            "description": "total number of resource attributes in both baseline and preview with conflicting values"
        },
        "preview_compliant": {
            "type": "boolean",
            "description": "true if the preview catalog has all content in the baseline (may contain more)"
        },
        "preview_equal": {
            "type": "boolean",
            "description": "true if the preview catalog is equal to the baseline catalog"
        },
        "version_equal": {
            "type": "boolean",
            "description": "true if the two catalogs have the same catalog version."
        },
        "missing_resources": {
            "description": "An array of resources in baseline that are not in preview",
            "type": "array",
            "items": {"$ref": "#/definitions/resource"}
        },
        "added_resources": {
            "description": "An array of resources in preview not in baseline",
            "type": "array",
            "items": {"$ref": "#/definitions/resource"}
        },
        "conflicting_resources": {
            "description": "An array of resources in both baseline and preview with conflicting attributes",
            "type": "array",
            "items": {"$ref": "#/definitions/conflicting_resource"}
        },
        "missing_edges": {
            "description": "An array of edges missing in preview",
            "type": "array",
            "items": {"$ref": "#/definitions/edge"}
        },
        "added_edges": {
            "description": "An array of edges in preview that are not in baseline",
            "type": "array",
            "items": {"$ref": "#/definitions/edge"}
        },
        "tags_ignored": {
            "type": "boolean",
            "description": "This delta was produced with tags being ignored"
        },
        "array_value_diff_ignored": {
            "type": "boolean",
            "description": "This delta was produced considering a value equal to a one element array containing that value"
        },
        "string_numeric_diff_ignored": {
            "type": "boolean",
            "description": "This delta was produced considering strings and numbers equal if their numeric representation is the same"
        }
    },
    "required": [
        "node_name",
        "timestamp",
        "produced_by",
        "baseline_env",
        "preview_env",
        "equal_resource_count",
        "added_resource_count",
        "missing_resource_count",
        "conflicting_resource_count",
        "added_edge_count",
        "missing_edge_count",
        "equal_attribute_count",
        "added_attribute_count",
        "missing_attribute_count",
        "conflicting_attribute_count",
        "preview_equal",
        "preview_compliant"
    ],
    "additionalProperties": false,
    "definitions": {
        "location": {
            "type": "object",
            "description": "Describes a location in a file/line",
            "properties": {
                "file": {"type": "string"},
                "line": {"type": "integer"}
            },
            "required": ["file"]
        },
        "attribute": {
            "properties": {
                "diff_id": {"type": "integer"},
                "name": {"type": "string"},
                "value": {}
            },
            "required": ["name", "value"],
            "additionalProperties": false
        },
        "conflicting_attribute": {
            "type": "object",
            "properties": {
                "diff_id": {"type": "integer"},
                "name": {"type": "string"},
                "baseline_value": {},
                "preview_value": {},
                "compliant": {
                    "type": "boolean",
                    "description": "Values different, but preview contains baseline"
                }
            },
            "required": ["name", "baseline_value", "preview_value"],
            "additionalProperties": false
        },
        "resource": {
            "type": "object",
            "properties": {
                "diff_id": {"type": "integer"},
                "location": {
                    "$ref": "#/definitions/location",
                    "description": "The location as reported in the preview"
                },
                "type": {"type": "string"},
                "title": {"type": "string"},
                "attributes": {
                    "type": "array",
                    "items": {"$ref": "#/definitions/attribute"}
                }
            },
            "required": ["type", "title"],
            "additionalProperties": false
        },
        "conflicting_resource": {
            "type": "object",
            "properties": {
                "baseline_location": {
                    "$ref": "#/definitions/location",
                    "description": "The location as reported in the baseline"
                },
                "preview_location": {
                    "$ref": "#/definitions/location",
                    "description": "The location as reported in the preview"
                },
                "diff_id": {"type": "integer"},
                "type": {"type": "string"},
                "title": {"type": "string"},
                "equal_attribute_count": {"type": "integer"},
                "missing_attribute_count": {"type": "integer"},
                "added_attribute_count": {"type": "integer"},
                "conflicting_attribute_count": {"type": "integer"},
                "missing_attributes": {
                    "type": "array",
                    "items": {"$ref": "#/definitions/attribute"}
                },
                "added_attributes": {
                    "type": "array",
                    "items": {"$ref": "#/definitions/attribute"}
                },
                "conflicting_attributes": {
                    "type": "array",
                    "items": {"$ref": "#/definitions/conflicting_attribute"}
                },
                "compliant": {
                    "type": "boolean",
                    "description": "Has attributes that differ, but all are compliant"
                }
            },
            "required": [
                "type",
                "title",
                "equal_attribute_count",
                "missing_attribute_count",
                "added_attribute_count",
                "conflicting_attribute_count"
            ],
            "additionalProperties": false
        },
        "edge": {
            "type": "object",
            "properties": {
                "source": {"type": "string"},
                "target": {"type": "string"},
                "diff_id": {"type": "integer"}
            },
            "required": ["source", "target", "diff_id"],
            "additionalProperties": false
        }
    }
}

